agent_id,agent_name,lane,status,phase_enabled,primary_deliverables,handoff_required_to,instruction_version,assigned_by,assigned_at,closeout_at,deliverable_evidence_ref,notes
019cfe90-2a3b-7a03-a4c2-b54f012ea523,Archimedes,rules_watch,active,1-13,rules_watch_digest;directive_capture_log;site_settings_mismatch_log;historical_rule_source_audit,data_governance,v4,Codex,2026-03-17,,Historical rules-source audit across linked Google Docs forum archives Discord-backed evidence local V1 materials and UPS_V2 governed cross-checks,Active visible subagent assigned to rules monitoring directive capture live site-settings mismatch detection and historical rule-source audit
019cfe90-2afd-71c0-ba86-ed86cb66fe45,Bacon,ux_review,active,1-13,journey_audit;friction_summary;navigation_recommendation_log,data_governance,v2,Codex,2026-03-17,,docs/ups_v2/V2_GOVERNED/ux/rulebook_html_ux_review_brief.md,Active visible subagent assigned to UX journey and friction review with current rulebook HTML handoff target
019cfda4-c3c7-7e81-bb86-3b696768b577,Darwin,data_governance,active,1-13,source_of_truth_updates;entity_contract_changes;governance_quality_notes;site_settings_alignment_updates,ops_runtime,v3,Codex,2026-03-17,,Active visible subagent and governance standards reviewer with ongoing responsibility for site-settings alignment discipline and discrepancy resolution routing,Active visible subagent and current governance standards reviewer
019cfda4-c54d-7401-8e56-0bcf1e9b5514,Curie,ops_runtime,active,1-13,job_runbook_updates;publish_safety_findings,mfl_matrix,v2,Codex,2026-03-17,,docs/ups_v2/V2_GOVERNED/governance/phase_reports/phase_0_completion_report.md,Current visible subagent assignment
019cfda4-c2db-7541-82c2-f02c674402cc,Cicero,mfl_matrix,active,1-6 primary,endpoint_triage_sheet;capability_gap_log,data_governance,v2,Codex,2026-03-17,,docs/ups_v2/V2_GOVERNED/governance/phase_reports/phase_0_completion_report.md,Current visible subagent assignment
,unassigned,future_lab,phase_disabled,11-13,experiment_log;promotion_recommendations,,v2,,,,,Enable only after Phase 11 gate
