finding_id,severity,module_paths,spec_section_cited,rule_summary,observed_behavior,gap,risk_summary,recommended_fix,blocked_by
F-CRIT-009,Critical,worker/src/index.js:5229-5263; site/acquisition/modules/free_agent_auction.js:10-100; site/acquisition/modules/expired_rookie_auction.js:10-100,"Section 2 line 947; Section 3 line 996",Auction nomination cadence: 2 per 24-hour window per franchise,performAuctionAction() accepts unlimited nominations; no per-franchise 24hr counter; no UI quota,No server-side counter and no UI quota indicator,Owner can spam nominations to control the auction slate; rule unenforceable; bid sheet cannot rely on cadence compliance,"Add nomination_log D1 table; worker checks count vs 2 in last 24h before accepting; UI shows N/2 quota",New D1 table + worker counter logic + UI display
F-CRIT-010,Critical,pipelines/etl/scripts/build_auction_value_model_v2.py:58 + 233,"Section 4; Memory scoring_history_eras.md (v13)",SF era starts 2022; TE Premium era starts 2025; concurrent (not sequential),"era_for() returns SF_TE_PREM for any season >= 2022 (line 233); SF_ERA_START hardcoded 2022 (line 58)",Missing SF_only era for 2022-2024; POSITION_INFLATION applies 2025+ TE multiplier (1.48) to 2022-2024 data,2022-2024 TE valuations inflated ~15-20%; auction bid sheet historically inaccurate; affects every owner using model output,"Add SF_only era 2022-2024 with correct historical TE multiplier; update era_for(); regenerate model and audit downstream consumers",Keith confirms historical TE multiplier value; model regen
F-CRIT-011,Critical,pipelines/etl/scripts/build_tag_tracking.py:90 + 186 + 223-246; site/ccc/ccc.js:4500-4700,"Section 2; Memory league_rules_2026_corrections.md lines 185-186",Tag eligibility: contract_year == 0 at submission time,ETL pre-computes eligibility; CCC UI filters via cached JSON; no server-side re-check at submission,UI-mediated only; mid-season manual contract edits leave the cached eligibility stale,"Tag applied to player with > 0 years remaining → invalid contract state, wrong salary, wrong tag-tier calc, corrupted cap audit","Worker tag-submission re-checks contract_year from fresh MFL rosters export; OR refresh tag_tracking.json hourly",Tag-submission worker hardening or hourly refresh
F-LOW-002,Low,worker/src/index.js:13763-13850,(non-league-functional),Rate limiting on public bug-report endpoint,No auth and no rate limit,No throttling on public POST,GitHub Issues spam (clutter only; not league-functional),IP-based rate limit max 5/hr,Rate-limit middleware
F-LOW-003,Low,worker/src/index.js:21265-21350,(informational endpoint),AI Q&A endpoint for extension questions,Validates question/context length but does not query D1 to verify a specific player's eligibility,Endpoint is informational; actual extension submission validated elsewhere (CCC),Owner confusion if AI advice is incomplete or system prompt drifts; UX issue not enforcement gap,"Optional: add structured /extension-eligibility-check endpoint; current /extension-assistant is fine for Q&A",Enhancement scope decision (not blocking)
F-LOW-004,Low,worker/src/index.js:2200-2242 (/mcm/nominate); worker/src/index.js:2244-2330 (/mcm/vote),(non-league-functional),Rate limiting and dedup for MCM endpoints,"/mcm/nominate has form validation but no rate limit and status='approved' hardcoded; /mcm/vote has IP-hash dedup at line 2292","No rate limit on nominate; no nominate-content dedup; vote endpoint dedup is partial",MCM page spam (cosmetic — MCM is non-league-functional fun side event),Rate-limit /mcm/nominate (2/IP/hr); add (display_name + URL) hash dedup over 7d window,Rate-limit middleware
F-GRAY-001,Gray,(codebase-wide),Section 6.A; Memory league_rules_2026_corrections.md,Cap floor $260K and ceiling $300K enforcement,No explicit cap-floor or cap-ceiling validation found in worker/site/ETL,"Either MFL enforces server-side (acceptable) or there is a real gap; cannot verify without runtime test",If MFL doesn't enforce: every cap-changing endpoint (drops/restructures/MYM/trades) could allow violations,Keith decides whether to add server-side floor/ceiling checks in worker; if added apply to all cap-changing endpoints,Keith decision on cap validation architecture
